{"apiVersion":"delegation-resilience.org/v0alpha2","dependencies":[{"id":"refund-connector","observedVersion":"unimplemented","type":"connector"},{"id":"refund-provider-status-api","observedVersion":"sandbox-v0","type":"outcome_source"},{"id":"refund-authorization-policy","observedVersion":"draft-v0","type":"policy"},{"id":"customer-operations-oncall","observedVersion":"illustrative-v0","type":"human_role"}],"evaluatedProfile":{"digest":"sha256:beab8cfcaf7f20dfacae1fae070f38aa3e8259f9047c72d6f41596af128bddbf","uri":"profile.json"},"issuer":{"id":"refund-dependency-observer","type":"workload"},"kind":"DependencySnapshot","metadata":{"id":"refund-dependencies","version":"0.2.0-alpha.1"},"observedAt":"2026-08-02T07:00:00Z","validUntil":"2026-09-01T00:00:00Z"}